{
  "track_selected": "web_nextjs",
  "stack_profile": "nextjs",
  "runner_type": "web",
  "template_id": "web_nextjs_standard_6h",
  "competency_bundle": [
    "web.fundamentals",
    "web.ui",
    "web.data_basic",
    "web.debugging"
  ],
  "variant_notes_for_student": "你选择了网页应用路线：我们会用 Next.js 来做页面与交互。"
}